{
  "schema_version": "1.0.0", "manifest_id": "siemens-s7-1500", "manifest_version": "0.1.0",
  "classification": "REFERENCE_HARDWARE", "validation_status": "TARGET", "selection_status": "PENDING_ENGINEERING_SELECTION",
  "manufacturer": "Siemens AG", "product_family": "SIMATIC S7-1500",
  "full_model_number": "CPU and order number PENDING ENGINEERING SELECTION", "firmware_version": "PENDING ENGINEERING SELECTION",
  "driver_or_sdk": { "name": "STEP 7 / TIA Portal and Vector OPC UA client stack", "version": "PENDING ENGINEERING SELECTION" },
  "operating_system": "PLC runtime plus engineering/edge operating systems PENDING ENGINEERING SELECTION", "protocols": ["OPC UA"],
  "licensing_status": "PENDING OPC UA FEATURE AND ENGINEERING LICENCE REVIEW", "lifecycle_status": "PENDING SIEMENS CONFIRMATION FOR SELECTED CPU/ORDER NUMBER",
  "source_datasheets": [{ "title": "SIMATIC S7-1500 Communication Function Manual", "url": "https://support.industry.siemens.com/cs/attachments/59192925/s71500_communication_function_manual_en-US_en-US.pdf", "retrieved_date": "2026-09-01" }],
  "required_evidence_gates": { "camera_discovery": "NOT_APPLICABLE", "acquisition": "NOT_APPLICABLE", "triggering": "NOT_APPLICABLE", "parameter_control": "NOT_APPLICABLE", "plc_exchange": "NOT_RUN", "reconnection_recovery": "NOT_RUN", "performance": "BLOCKED", "timestamp_correlation": "NOT_RUN", "security": "NOT_RUN", "soak_72_hour": "NOT_RUN" },
  "limitations": ["OPC UA capabilities, client/server role, security profiles, limits and licensing depend on the exact CPU and firmware.", "No compatibility or certification claim."]
}
