{
  "schema_version": "1.0.0", "manifest_id": "basler-racer2-gige", "manifest_version": "0.1.0",
  "classification": "REFERENCE_HARDWARE", "validation_status": "TARGET", "selection_status": "PENDING_ENGINEERING_SELECTION",
  "manufacturer": "Basler AG", "product_family": "racer 2 GigE line-scan",
  "full_model_number": "PENDING ENGINEERING SELECTION", "firmware_version": "PENDING ENGINEERING SELECTION",
  "driver_or_sdk": { "name": "Basler pylon Camera Software Suite", "version": "PENDING ENGINEERING SELECTION" },
  "operating_system": "PENDING ENGINEERING SELECTION", "protocols": ["GenICam", "GigE Vision"],
  "licensing_status": "PENDING LICENCE REVIEW", "lifecycle_status": "PENDING MANUFACTURER CONFIRMATION FOR SELECTED SUFFIX",
  "source_datasheets": [{ "title": "Basler racer 2 product documentation", "url": "https://docs.baslerweb.com/basler-racer-2", "retrieved_date": "2026-09-01" }],
  "required_evidence_gates": { "camera_discovery": "NOT_RUN", "acquisition": "NOT_RUN", "triggering": "NOT_RUN", "parameter_control": "NOT_RUN", "plc_exchange": "NOT_APPLICABLE", "reconnection_recovery": "NOT_RUN", "performance": "BLOCKED", "timestamp_correlation": "NOT_RUN", "security": "NOT_RUN", "soak_72_hour": "NOT_RUN" },
  "limitations": ["Exact suffix, resolution, mono/colour choice, line rate, encoder/trigger design, optics and lighting require engineering selection.", "No compatibility or certification claim."]
}
