{
  "schema_version": "1.0.0", "manifest_id": "modbus-24v-remote-io", "manifest_version": "0.1.0",
  "classification": "REFERENCE_HARDWARE", "validation_status": "TARGET", "selection_status": "PENDING_ENGINEERING_SELECTION",
  "manufacturer": "PENDING ENGINEERING SELECTION", "product_family": "Isolated 24 VDC Modbus TCP remote I/O",
  "full_model_number": "PENDING ENGINEERING SELECTION", "firmware_version": "PENDING ENGINEERING SELECTION",
  "driver_or_sdk": { "name": "Vector Modbus TCP adapter and vendor configuration tool", "version": "PENDING ENGINEERING SELECTION" },
  "operating_system": "Embedded device firmware plus edge OS PENDING ENGINEERING SELECTION", "protocols": ["Modbus TCP", "24 VDC isolated digital I/O"],
  "licensing_status": "PENDING LICENCE REVIEW", "lifecycle_status": "PENDING MANUFACTURER AND MODEL SELECTION",
  "source_datasheets": [{ "title": "Modbus specifications and implementation guides", "url": "https://www.modbus.org/modbus-specifications", "retrieved_date": "2026-09-01" }],
  "required_evidence_gates": { "camera_discovery": "NOT_APPLICABLE", "acquisition": "NOT_APPLICABLE", "triggering": "NOT_RUN", "parameter_control": "NOT_APPLICABLE", "plc_exchange": "NOT_RUN", "reconnection_recovery": "NOT_RUN", "performance": "BLOCKED", "timestamp_correlation": "NOT_RUN", "security": "NOT_RUN", "soak_72_hour": "NOT_RUN" },
  "limitations": ["Manufacturer datasheet is mandatory after exact model selection; protocol specification alone is insufficient.", "Electrical isolation, channel type/count, default state and failure behaviour are unverified.", "Not a safety-rated I/O device unless separately certified outside Vector."]
}
