{
  "schema_version": "1.0.0", "manifest_id": "codesys-control", "manifest_version": "0.1.0",
  "classification": "REFERENCE_HARDWARE", "validation_status": "TARGET", "selection_status": "PENDING_ENGINEERING_SELECTION",
  "manufacturer": "CODESYS GmbH", "product_family": "CODESYS Control",
  "full_model_number": "Runtime edition and host hardware PENDING ENGINEERING SELECTION", "firmware_version": "CODESYS runtime version PENDING ENGINEERING SELECTION",
  "driver_or_sdk": { "name": "CODESYS Development System, OPC UA and Modbus components", "version": "PENDING ENGINEERING SELECTION" },
  "operating_system": "Runtime host operating system PENDING ENGINEERING SELECTION", "protocols": ["OPC UA", "Modbus TCP"],
  "licensing_status": "PENDING RUNTIME, OPC UA TAG/CAPACITY AND MODBUS LICENCE SELECTION", "lifecycle_status": "PENDING CODESYS SUPPORT CONFIRMATION FOR SELECTED RUNTIME",
  "source_datasheets": [{ "title": "CODESYS OPC UA Communication", "url": "https://www.codesys.com/products/fieldbus-communication/opc-ua/", "retrieved_date": "2026-09-01" }, { "title": "CODESYS licensing", "url": "https://www.codesys.com/ecosystem/discover-codesys/licensing/", "retrieved_date": "2026-09-01" }],
  "required_evidence_gates": { "camera_discovery": "NOT_APPLICABLE", "acquisition": "NOT_APPLICABLE", "triggering": "NOT_APPLICABLE", "parameter_control": "NOT_APPLICABLE", "plc_exchange": "NOT_RUN", "reconnection_recovery": "NOT_RUN", "performance": "BLOCKED", "timestamp_correlation": "NOT_RUN", "security": "NOT_RUN", "soak_72_hour": "NOT_RUN" },
  "limitations": ["CODESYS-compatible does not define an exact controller, runtime edition, host, licence capacity or security profile.", "No compatibility or certification claim."]
}
